{
  "$schema": "https://json-schema.org/draft/2020-12/schema",
  "$id": "https://verityspec.org/schemas/v0.1/observability/observability-dashboard.schema.json",
  "title": "Observability Dashboard",
  "type": "object",
  "additionalProperties": false,
  "required": ["id", "kind", "name", "status", "owner", "description", "url"],
  "properties": {
    "id": {
      "type": "string",
      "pattern": "^[a-z][a-z0-9]*(?:[._-][a-z0-9]+)*$"
    },
    "kind": {
      "type": "string",
      "const": "observability.dashboard"
    },
    "name": {
      "type": "string",
      "minLength": 1
    },
    "description": {
      "type": "string",
      "minLength": 1
    },
    "status": {
      "type": "string",
      "enum": ["draft", "review", "ready", "deprecated", "removed"]
    },
    "owner": {
      "type": "string",
      "minLength": 1
    },
    "url": {
      "type": "string",
      "minLength": 1
    },
    "audience": {
      "type": "string",
      "enum": ["engineering", "operations", "support", "leadership", "external"]
    },
    "references": {
      "type": "array",
      "items": {
        "type": "object",
        "additionalProperties": false,
        "required": ["type", "target"],
        "properties": {
          "type": {
            "type": "string"
          },
          "target": {
            "type": "string"
          },
          "required": {
            "type": "boolean",
            "default": true
          }
        }
      },
      "default": []
    }
  }
}
